[
  {
    "user_input":"What were JPMorgan's total net revenues in fiscal year 2024?",
    "retrieved_contexts":[
      "Refer to Notes 6 and 34 for\nadditional information.\nComparisons noted in the sections below are for the full year\nof 2024 versus the full year of 2023, unless otherwise\nspecified.\nFirmwide overview\nJPMorganChase reported net income of $58.5 billion for\n2024, up 18%, earnings per share of $19.75, ROE of 18%\nand ROTCE of 22%.\n\u2022 Total net revenue was $177.6 billion, up 12%, reflecting:\n\u2013 Net interest income (\u201cNII\u201d) of $92.6 billion, up 4%,\ndriven by the impact of balance sheet actions, primarily\nreinvestments in the investment securities portfolio,\nhigher revolving balances in Card Services, the timing\nimpact of First Republic, higher wholesale deposit\nbalances, and higher Markets net interest income, largely\noffset by deposit margin compression across the lines of\nbusiness and lower average deposit balances in CCB.\nNII excluding Markets was $92.4 billion, up 3%.\n\u2013 Noninterest revenue (\u201cNIR\u201d) was $85.0 billion, up 23%,\npredominantly driven by a $7.9 billion net gain related to\nVisa shares recorded in the second quarter of 2024,\nhigher asset management fees in AWM and CCB, higher\ninvestment banking fees, and lower net investment\nsecurities losses in Treasury and CIO.\nThe prior year included the estimated bargain purchase\ngain of $2.8 billion associated with First Republic.\n(a)(b)\n(c)\n(c)\n(c)\n\nJPMorgan Chase & Co.\/2024 Form 10-K\n4\/20\/26, 11:14 AM\njpm-20241231\nhttps:\/\/www.sec.gov\/Archives\/edgar\/data\/19617\/000001961725000270\/jpm-20241231.htm\n57\/345",
      "Total net revenue\n$\n17,394\u00a0\n$\n8,038\u00a0\n$\n\nNet income\/(loss)\nTreasury and CIO\n7,013\u00a0\n4,206\u00a0\n(197)\nOther Corporate\n3,588\u00a0\n(1,385)\n(546)\nTotal net\nincome\/(loss)\n$\n10,601\u00a0\n$\n2,821\u00a0\n$\n(743)\nTotal assets (period-\nend)\n$\n1,323,967\u00a0\n$ 1,348,437\u00a0\n$ 1,328,219\u00a0\nLoans (period-end)\n1,964\u00a0\n1,924\u00a0\n2,181\u00a0\nDeposits\n27,581\u00a0\n21,826\u00a0\n14,203\u00a0\nEmployees\n49,610\u00a0\n47,530\u00a0\n44,196\u00a0\n(a) Included tax-equivalent adjustments, predominantly driven by tax-exempt\nincome from municipal bonds, of $182 million, $211\nmillion and $235 million for the years ended December\u00a031, 2024, 2023\nand 2022, respectively.\n(b) Predominantly relates to the Firm's international consumer initiatives.\n(c) Included the net gain related to Visa shares of $7.9 billion recorded in the\nsecond quarter of 2024. Refer to Notes 2 and 6 for additional information.\n(d) Included a $1.0 billion contribution of Visa shares to the JPMorgan\nChase Foundation recorded in the second quarter of 2024. Refer to\nNotes 2 and 6 for additional information.\n(e) The first quarter of 2024 included an increase of $725\u00a0million to the FDIC\nspecial assessment reflecting the FDIC's revised estimate of Deposit\nInsurance Fund losses. The fourth quarter of 2023 included the\n$2.9\u00a0billion FDIC special assessment.\n(f) Included the estimated bargain purchase gain of $2.8 billion for the year\nended December\u00a031, 2023 associated with the First Republic acquisition.\nRefer to Notes 6 and 34 for additional information.\n(g) In the second quarter of 2023, substantially all of the expense associated\nwith First Republic was reported in Corporate.",
      "International metrics\nYear ended December 31,\n(in billions, except where\notherwise noted)\n2024\n2023\n2022\nTotal net revenue (in millions)\nEurope\/Middle East\/Africa\n$\n3,563\u00a0 $\n3,377\u00a0 $\n3,240\u00a0\nAsia-Pacific\n2,023\u00a0\n1,876\u00a0\n1,836\u00a0\nLatin America\/Caribbean\n1,065\u00a0\n\n\nTotal international net revenue\n6,651\u00a0\n6,238\u00a0\n6,043\u00a0\nNorth America\n14,927\u00a0\n13,589\u00a0\n11,705\u00a0\nTotal net revenue\n$\n21,578\u00a0 $\n19,827\u00a0 $\n17,748\u00a0\nAssets under management\nEurope\/Middle East\/Africa\n$\n604\u00a0 $\n539\u00a0 $\n\nAsia-Pacific\n\n\n\nLatin America\/Caribbean\n\n\n\nTotal international assets under\nmanagement\n1,012\u00a0\n\n\nNorth America\n3,033\u00a0\n2,534\u00a0\n1,992\u00a0\nTotal assets under\nmanagement\n$\n4,045\u00a0 $\n3,422\u00a0 $\n2,766\u00a0\nClient assets\nEurope\/Middle East\/Africa\n$\n841\u00a0 $\n740\u00a0 $\n\nAsia-Pacific\n\n\n\nLatin America\/Caribbean\n\n\n\nTotal international client assets\n1,577\u00a0\n1,378\u00a0\n1,130\u00a0\nNorth America\n4,355\u00a0\n3,634\u00a0\n2,918\u00a0\nTotal client assets\n$\n5,932\u00a0 $\n5,012\u00a0 $\n4,048\u00a0\n(a) Regional revenue is based on the domicile of the client.\n(a)\nJPMorgan Chase & Co.\/2024 Form 10-K\n\n4\/20\/26, 11:14 AM\njpm-20241231\nhttps:\/\/www.sec.gov\/Archives\/edgar\/data\/19617\/000001961725000270\/jpm-20241231.htm\n91\/345"
    ],
    "response":"JPMorgan's total net revenues in fiscal year 2024 were $177.6 billion.",
    "reference":"JPMorgan's total net revenues in fiscal year 2024 were $177.6 billion.",
    "faithfulness":1.0,
    "answer_relevancy":1.0,
    "context_precision":0.8333333333,
    "context_recall":1.0
  },
  {
    "user_input":"What was JPMorgan's return on equity in 2024?",
    "retrieved_contexts":[
      "1.62\u00a0\n286,605\u00a0\n9,396\u00a0\n3.28\u00a0\n268,019\u00a0\n3,246\u00a0\n1.21\u00a0\n18,648\u00a0\n\n5.11\u00a0\n11,208\u00a0\n\n2.02\u00a0\n296,433\u00a0\n15,803\u00a0\n5.33\u00a0\n250,080\u00a0\n8,075\u00a0\n3.23\u00a0\n2,593,769\u00a0\n81,321\u00a0\n3.14\u00a0\n2,566,798\u00a0\n26,097\u00a0\n1.02\u00a0\n660,538\u00a0\n719,249\u00a0\n30,501\u00a0\n39,155\u00a0\n46,355\u00a0\n57,388\u00a0\n181,601\u00a0\n185,989\u00a0\n3,512,764\u00a0\n3,568,579\u00a0\n27,404\u00a0\n31,893\u00a0\n282,056\u00a0\n253,068\u00a0\n309,460\u00a0\n284,961\u00a0\n$\n3,822,224\u00a0\n$\n3,853,540\u00a0\n2.00\u00a0%\n1.76\u00a0%\n$\n89,747\u00a0\n2.70\u00a0\n$\n67,144\u00a0\n2.00\u00a0\n(g) The ratio of average stockholders\u2019 equity to average assets was 8.2%, 8.1% and 7.4% for the years ended December\u00a031, 2024, 2023 and 2022, respectively.\nThe return on average stockholders\u2019 equity, based on net income, was 17.4%, 16.0% and 13.2% for the years ended December\u00a031, 2024, 2023 and 2022,\nrespectively.\n(h) Included fees and commissions on loans of $3.6 billion, $2.2 billion and $1.8 billion for the years ended December\u00a031, 2024, 2023 and 2022, respectively.\n(i)\nThe annualized rate for securities based on amortized cost was 3.79%, 3.09% and 1.75% for the years ended December\u00a031, 2024, 2023 and 2022,\nrespectively, and does not give effect to changes in fair value that are reflected in AOCI.",
      "FIVE-YEAR STOCK PERFORMANCE\nThe following table and graph compare the five-year cumulative total return for JPMorgan Chase & Co. (\u201cJPMorganChase\u201d or the\n\u201cFirm\u201d) common stock with the cumulative return of the S&P 500 Index, the KBW Bank Index and the S&P Financials Index. The\nS&P 500 Index is a commonly referenced equity benchmark in the United States of America (\u201cU.S.\u201d), consisting of leading\ncompanies from different economic sectors. The KBW Bank Index seeks to reflect the performance of banks and thrifts that are\npublicly traded in the U.S. and is composed of leading national money center and regional banks and thrifts. The S&P Financials\nIndex is an index of financial companies, all of which are components of the S&P 500. The Firm is a component of all three\nindustry indices.\nThe following table and graph assume simultaneous investments of $100 on December 31, 2019, in JPMorganChase common\nstock and in each of the above indices. The comparison assumes that all dividends were reinvested.\nDecember 31,\n(in dollars)\n2019\n2020\n2021\n2022\n2023\n2024\nJPMorganChase\n$\n100.00\u00a0\n$\n94.48\u00a0\n$\n120.68\u00a0\n$\n105.48\u00a0\n$\n137.91\u00a0\n$\n198.96\u00a0\nKBW Bank Index\n100.00\u00a0\n89.69\u00a0\n124.08\u00a0\n97.53\u00a0\n96.66\u00a0\n132.62\u00a0\nS&P Financials Index\n100.00\u00a0\n98.24\u00a0\n132.50\u00a0\n118.54\u00a0\n132.94\u00a0\n173.57\u00a0\nS&P 500 Index\n100.00\u00a0\n118.39\u00a0\n152.34\u00a0\n124.75\u00a0\n157.54\u00a0\n196.96\u00a0\nDecember 31,\n(in dollars)\nJPMorgan Chase & Co.\/2024 Form 10-K",
      "Refer to Notes 6 and 34 for\nadditional information.\nComparisons noted in the sections below are for the full year\nof 2024 versus the full year of 2023, unless otherwise\nspecified.\nFirmwide overview\nJPMorganChase reported net income of $58.5 billion for\n2024, up 18%, earnings per share of $19.75, ROE of 18%\nand ROTCE of 22%.\n\u2022 Total net revenue was $177.6 billion, up 12%, reflecting:\n\u2013 Net interest income (\u201cNII\u201d) of $92.6 billion, up 4%,\ndriven by the impact of balance sheet actions, primarily\nreinvestments in the investment securities portfolio,\nhigher revolving balances in Card Services, the timing\nimpact of First Republic, higher wholesale deposit\nbalances, and higher Markets net interest income, largely\noffset by deposit margin compression across the lines of\nbusiness and lower average deposit balances in CCB.\nNII excluding Markets was $92.4 billion, up 3%.\n\u2013 Noninterest revenue (\u201cNIR\u201d) was $85.0 billion, up 23%,\npredominantly driven by a $7.9 billion net gain related to\nVisa shares recorded in the second quarter of 2024,\nhigher asset management fees in AWM and CCB, higher\ninvestment banking fees, and lower net investment\nsecurities losses in Treasury and CIO.\nThe prior year included the estimated bargain purchase\ngain of $2.8 billion associated with First Republic.\n(a)(b)\n(c)\n(c)\n(c)\n\nJPMorgan Chase & Co.\/2024 Form 10-K\n4\/20\/26, 11:14 AM\njpm-20241231\nhttps:\/\/www.sec.gov\/Archives\/edgar\/data\/19617\/000001961725000270\/jpm-20241231.htm\n57\/345"
    ],
    "response":"JPMorgan's return on equity (ROE) in 2024 was 18%.",
    "reference":"JPMorgan's return on equity in 2024 was 18%.",
    "faithfulness":1.0,
    "answer_relevancy":0.9828020846,
    "context_precision":0.3333333333,
    "context_recall":1.0
  },
  {
    "user_input":"What were Goldman Sachs net revenues in 2024?",
    "retrieved_contexts":[
      "THE GOLDMAN SACHS GROUP, INC. AND SUBSIDIARIES\nManagement\u2019s Discussion and Analysis\n2024 versus 2023. Net revenues in Global Banking &\nMarkets were $34.94 billion for 2024, 16% higher than 2023.\nInvestment banking fees were $7.73 billion, 24% higher than\n2023, primarily reflecting significantly higher net revenues in\nDebt underwriting, primarily driven by leveraged finance\nactivity, and in Equity underwriting, primarily driven by\nsecondary and initial public offerings. In addition, net revenues\nin Advisory were higher, reflecting an increase in completed\nmergers and acquisitions transactions.\nAs of December 2024, our Investment banking fees backlog\nincreased compared with the end of 2023, primarily reflecting\nhigher estimated net revenues from potential advisory\ntransactions.\nOur backlog represents an estimate of our net revenues from\nfuture transactions where we believe that future revenue\nrealization is more likely than not. We believe changes in our\nbacklog may be a useful indicator of client activity levels\nwhich, over the long term, impact our net revenues. However,\nthe time frame for completion and corresponding revenue\nrecognition of transactions in our backlog varies based on the\nnature of the assignment, as certain transactions may remain in\nour backlog for longer periods of time. In addition, our backlog\nis subject to certain limitations, such as assumptions about the\nlikelihood that individual client transactions will occur in the\nfuture. Transactions may be cancelled or modified, and\ntransactions not included in the estimate may also occur.\nNet revenues in FICC were $13.20 billion, 9% higher than\n2023, primarily reflecting significantly higher net revenues in\nFICC financing, primarily driven by mortgages and structured\nlending. Net revenues in FICC intermediation were slightly\nhigher, driven by significantly higher net revenues in\ncurrencies, mortgages and credit products, largely offset by\nlower net revenues in interest rate products and significantly\nlower net revenues in commodities.\nThe increase in FICC intermediation net revenues reflected the\nimpact of improved market-making conditions on our\ninventory, partially offset by lower client activity.",
      "Diluted earnings per\ncommon share (EPS) was $40.54 for 2024, compared with\n$22.87 for 2023. ROE was 12.7% for 2024, compared with\n7.5% for 2023. Book value per common share was $336.77 as\nof December 2024, 7.4% higher compared with December\n2023.\nNet revenues were $53.51\u00a0 billion for 2024, 16% higher than\n2023, primarily reflecting higher net revenues in Global\nBanking & Markets and Asset & Wealth Management. The\nincrease in net revenues in Global Banking & Markets\nprimarily \nreflected \nhigher \nnet \nrevenues \nin \nEquities,\nsignificantly higher Investment banking fees and higher net\nrevenues in Fixed Income, Currency and Commodities (FICC).\nThe increase in net revenues in Asset & Wealth Management\nprimarily reflected significantly higher net revenues in Equity\ninvestments and higher Management and other fees. Net\nrevenues in Platform Solutions were slightly higher.\nProvision for credit losses was $1.35\u00a0 billion for 2024,\ncompared with $1.03\u00a0 billion for 2023. Provisions for 2024\nreflected net provisions related to the credit card portfolio\n(primarily driven by net charge-offs). Provisions for 2023\nreflected net provisions related to both the credit card portfolio\n(primarily driven by net charge-offs) and wholesale loans\n(primarily driven by impairments), partially offset by reserve\nreductions related to the transfer of the GreenSky loan portfolio\nto held for sale and the sale of substantially all of the Marcus\nby Goldman Sachs (Marcus) loan portfolio.",
      "Market\nmaking revenues from financing activities were essentially\nunchanged, reflecting significantly lower revenues in FICC\nfinancing, offset by significantly higher revenues from Equities\nfinancing.\nOther principal transactions revenues in the consolidated\nstatements of earnings were $4.65 billion for 2024, 119%\nhigher than 2023, primarily reflecting significantly higher net\ngains from investments in private equities, significantly higher\nnet gains from derivatives related to our funding activities, the\nimpact of the sale of the Marcus loan portfolio in 2023\n(including net revenues of approximately $(370) million\nrelated to the sale of substantially all of the portfolio) and\nsignificantly lower net losses on hedges related to our\nrelationship lending portfolio.\nGoldman Sachs 2024 Form 10-K\n\n4\/20\/26, 11:19 AM\ngs-20241231\nhttps:\/\/www.sec.gov\/Archives\/edgar\/data\/886982\/000088698225000005\/gs-20241231.htm\n130\/506"
    ],
    "response":"Goldman Sachs' net revenues for 2024 were $53.51 billion.",
    "reference":"Goldman Sachs reported net revenues of $53.51 billion in 2024, a 16% increase compared to 2023.",
    "faithfulness":1.0,
    "answer_relevancy":0.9961132329,
    "context_precision":0.5833333333,
    "context_recall":1.0
  },
  {
    "user_input":"What was JPMorgan's provision for credit losses in 2024 and how did it compare to 2023?",
    "retrieved_contexts":[
      "Provision for credit losses\nYear ended December 31,\n(in millions)\n2024\n2023\n2022\nConsumer, excluding credit card\n$\n\n$\n\n$\n\nCredit card\n9,292\u00a0\n6,048\u00a0\n3,353\u00a0\nTotal consumer\n9,923\u00a0\n6,983\u00a0\n3,859\u00a0\nWholesale\n\n2,299\u00a0\n2,476\u00a0\nInvestment securities\n\n\n\nTotal provision for credit losses\n$\n10,678\u00a0\n$\n9,320\u00a0\n$\n6,389\u00a0\n2024 compared with 2023\nThe provision for credit losses was $10.7 billion, reflecting\n$8.6 billion of net charge-offs and a $2.0 billion net addition to\nthe allowance for credit losses.\nNet charge-offs included $7.8 billion in consumer,\npredominantly driven by Card Services, reflecting the\nseasoning of vintages originated in recent years, credit\nnormalization and balance growth, and $0.8 billion in\nwholesale, primarily in Real Estate, largely concentrated in\nOffice.\nThe net addition to the allowance for credit losses consisted\nof:\n\u2022 $2.1 billion in consumer, reflecting:\n\u2013 a $2.2 billion net addition in Card Services,\npredominantly driven by loan growth, reflecting higher\nrevolving balances, including the seasoning of vintages\noriginated in recent years,\npartially offset by\n\u2013 a $125 million net reduction in Home Lending in the first\nquarter of 2024, and\n\u2022 a net reduction of $19 million in wholesale, reflecting:\n\u2013 changes in certain macroeconomic variables, an update\nto loss assumptions on certain loans in Markets, and a\nreduction due to charge-offs largely from collateral-\ndependent loans,\npredominantly offset by\n\u2013 net downgrade activity, primarily in Real Estate, and the\nimpact of incorporating the First Republic portfolio into\nthe Firm\u2019s modeled credit loss estimates in the second\nquarter of 2024.",
      "The provision for credit losses was $10.0 billion, reflecting:\n\u2022 net charge-offs of $7.9 billion, up $2.6 billion, including $2.4\nbillion in Card Services, reflecting the seasoning of\nvintages originated in recent years, credit normalization\nand balance growth, and\n\u2022 a $2.0 billion net addition to the allowance for credit losses,\nconsisting of:\n\u2013 $2.2 billion in Card Services, predominantly driven by\nloan growth, reflecting higher revolving balances,\nincluding the seasoning of vintages originated in recent\nyears,\npartially offset by\n\u2013 a $125 million net reduction in Home Lending, primarily\ndue to improvements in the outlook for home prices in the\nfirst quarter of 2024.\nThe provision in the prior year was $6.9 billion, reflecting net\ncharge-offs of $5.3 billion, a $1.2 billion net addition to the\nallowance for credit losses, predominantly driven by Card\nServices, and a $408 million net addition to the allowance for\ncredit losses to establish the allowance for the First Republic\nloans and lending-related commitments in the second quarter\nof 2023.\nRefer to Credit and Investment Risk Management on pages\n117\u2013140 and Allowance for Credit Losses on pages 137\u2013139\nfor a further discussion of the credit portfolios and the\nallowance for credit losses.\n\nJPMorgan Chase & Co.\/2024 Form 10-K\n4\/20\/26, 11:14 AM\njpm-20241231\nhttps:\/\/www.sec.gov\/Archives\/edgar\/data\/19617\/000001961725000270\/jpm-20241231.htm\n77\/345",
      "2024 compared with 2023\nNet income was $10.6 billion, compared with $2.8 billion in\nthe prior year.\nNet revenue was $17.4 billion, compared with $8.0 billion in\nthe prior year.\nNet interest income was $9.8 billion, up 24%, driven by the\nimpact of balance sheet actions, primarily reinvestments in\nthe investment securities portfolio, partially offset by the net\nimpact of rates.\nNoninterest revenue was $7.6 billion, compared with $132\nmillion in the prior year. Excluding the $7.9 billion net gain\nrelated to Visa shares recorded in the second quarter of 2024\nand the prior-year $2.8 billion estimated bargain purchase\ngain associated with the First Republic acquisition, revenue\nwas up $2.4 billion, predominantly driven by lower investment\nsecurities losses, primarily on sales of U.S. Treasuries and\nU.S. GSE and government agency MBS, associated with\nrepositioning the investment securities portfolio in Treasury\nand CIO.\nNoninterest expense was $4.0 billion, down 29%, driven by:\n\u2022 a lower FDIC special assessment,\n\u2022 lower expense associated with the First Republic\nacquisition as the prior year expense in Corporate included\nindividuals associated with First Republic who were not\nemployees of the Firm until July 2023, and this expense\nwas subsequently aligned to the appropriate LOBs starting\nin the third quarter of 2023, and\n\u2022 lower legal expense,\npartially offset by\n\u2022 a $1.0 billion contribution of Visa shares to the JPMorgan\nChase Foundation recorded in the second quarter of 2024,\nand\n\u2022 higher costs associated with the Firm's international\nconsumer initiatives.\nThe provision for credit losses was $10 million.\nThe provision in the prior year was $171 million, reflecting a\nnet addition to the allowance for credit losses related to a\nsingle name exposure, which was subsequently charged off\nupon the restructuring of a loan.\nRefer to Note 10 and Note 13 for additional information on\nthe investment securities portfolio and the allowance for\ncredit losses."
    ],
    "response":"JPMorgan's provision for credit losses in 2024 was $10.7 billion. This represented an increase compared to the provision of $9.3 billion in 2023. The increase was primarily due to net charge-offs of $8.6 billion and a net addition of $2.0 billion to the allowance for credit losses.",
    "reference":"JPMorgan reported a provision for credit losses of $10.7 billion in 2024, up from $9.3 billion in 2023. The provision included $8.6 billion in net charge-offs, driven primarily by Card Services consumer loans.",
    "faithfulness":0.75,
    "answer_relevancy":1.0,
    "context_precision":0.9999999999,
    "context_recall":1.0
  },
  {
    "user_input":"What is Goldman Sachs strategy for Asset and Wealth Management?",
    "retrieved_contexts":[
      "Asset & Wealth Management\nAsset & Wealth Management provides investment services to\nhelp clients preserve and grow their financial assets and\nachieve their financial goals. We provide these services to our\nclients, both institutional and individuals, including investors\nwho primarily access our products through a network of third-\nparty distributors around the world.\nWe manage client assets across a broad range of investment\nstrategies and asset classes, including equity, fixed income and\nalternative investments. Alternative investments primarily\nincludes hedge funds, credit funds, private equity, real estate,\ncurrencies, commodities and asset allocation strategies. Our\ninvestment offerings include those managed on a fiduciary\nbasis by our portfolio managers, as well as those managed by\nthird-party managers. We offer our investment solutions in a\nvariety of structures, including separately managed accounts,\nmutual funds, private partnerships and other commingled\nvehicles.\nWe also provide customized investment advisory solutions\ndesigned to address our clients\u2019 investment needs. These\nsolutions begin with identifying clients\u2019 objectives and\ncontinue through portfolio construction, ongoing asset\nallocation and risk management and investment realization. We\ndraw from a variety of third-party managers, as well as our\nproprietary offerings, to implement solutions for clients.\nWe also provide tailored wealth advisory services, primarily to\nultra-high-net worth clients. We operate globally, serving\nindividuals, families, family offices, and foundations and\nendowments. Our relationships are established directly or\nintroduced through companies that sponsor financial wellness\nor financial planning programs for their employees, as well as\nthrough corporate referrals.\nWe offer personalized financial planning to individuals and\nalso provide customized investment advisory solutions, and\noffer structuring and execution capabilities in securities and\nderivative products across all major global markets. In\naddition, we offer clients a full range of private banking\nservices, including a variety of deposit alternatives and loans\nthat our clients use to finance investments in both financial and\nnonfinancial assets, bridge cash flow timing gaps or provide\nliquidity and flexibility for other needs. We also raise deposits\nfrom consumers through Marcus by Goldman Sachs (Marcus).",
      "THE GOLDMAN SACHS GROUP, INC. AND SUBSIDIARIES\nSustainability\nWe have a long-standing commitment to sustainability. Our\ntwo priorities in this area are helping clients across industries\ndecarbonize their businesses to support their transitions to a\nlow-carbon economy (Climate Transition) and to advance\nsolutions that expand access, increase affordability, and drive\noutcomes to support sustainable economic growth (Inclusive\nGrowth). Our strategy is to advance these two priorities\nthrough our work with our clients, and with strategic partners\nwhose strengths and areas of focus complement our own, as\nwell as through our supply chain.\nOur Sustainable Finance Group serves as the centralized group\nthat drives our sustainability strategy and related efforts across\nour firm, including the commercial approach alongside our\nbusinesses, to advance Climate Transition and Inclusive\nGrowth. Our sustainable finance-related efforts continue to\nevolve. For example, within Global Banking & Markets, we\nestablished the Sustainable Banking Group, a group focused on\ndelivering analysis, advice, and capital solutions for clients\nfocused on their sustainability objectives. Within Asset &\nWealth Management, we provide clients sustainability-related\ncapabilities, across public and private markets and open\narchitecture, proprietary and third-party products, portfolio\nstrategy and implementation, and specialist sustainability teams\nand strategies.\nOur activities relating to sustainability present both financial\nand nonfinancial risks, and we have processes for managing\nthese risks, similar to the other risks we face. We have\nintegrated oversight of climate-related risks into our risk\nmanagement governance structure, from senior management to\nour Board and its committees, including the Risk and Public\nResponsibilities committees. The Risk Committee of the Board\noversees firmwide financial and nonfinancial risks, which\ninclude climate risk, and, as part of its oversight, receives\nupdates on our risk management approach to climate risk. The\nPublic Responsibilities Committee of the Board assists the\nBoard in its oversight of our firmwide sustainability strategy\nand sustainability issues affecting us, including with respect to\nclimate change.",
      "The firm also makes equity and debt investments\nrelated to Global Banking & Markets activities.\nAsset & Wealth Management\nThe firm manages assets and offers investment products across\nall major asset classes to a diverse set of clients, both\ninstitutional and individuals, including through a network of\nthird-party distributors around the world. The firm also\nprovides investing and wealth advisory solutions, including\nfinancial planning and counseling, and executing brokerage\ntransactions for wealth management clients. The firm issues\nloans to wealth management clients and raises deposits through\nits consumer banking digital platform, Marcus by Goldman\nSachs (Marcus), and through its private bank. The firm makes\nequity investments, which include investing activities related\nto public and private equity investments in corporate, real\nestate and infrastructure assets, as well as investments through\nconsolidated investment entities (CIEs), substantially all of\nwhich are engaged in real estate investment activities. The firm\nalso invests in debt instruments and engages in lending\nactivities to middle-market clients, and provides financing for\nreal estate and other assets.\nPlatform Solutions\nThe firm issues credit cards through partnership arrangements,\nraises deposits from Apple Card customers and provides\ntransaction banking and other services, such as deposit-taking,\npayment solutions and other cash management services, for\ncorporate and institutional clients. See Note 9 for information\nabout the General Motors (GM) credit card program and the\nfirm\u2019s seller financing loans.\n4\/20\/26, 11:19 AM\ngs-20241231\nhttps:\/\/www.sec.gov\/Archives\/edgar\/data\/886982\/000088698225000005\/gs-20241231.htm\n264\/506"
    ],
    "response":"Goldman Sachs' strategy for Asset and Wealth Management focuses on providing a comprehensive range of investment services to help clients preserve and grow their financial assets and achieve their financial goals. Key components of their strategy include:\n\n1. **Diverse Investment Offerings**: They manage client assets across various investment strategies and asset classes, including equity, fixed income, and alternative investments (such as hedge funds, private equity, real estate, and commodities). This diversity allows them to cater to a wide range of client needs.\n\n2. **Customized Solutions**: Goldman Sachs emphasizes tailored investment advisory solutions that begin with understanding clients' objectives and continue through portfolio construction, ongoing asset allocation, risk management, and investment realization. They utilize both proprietary offerings and third-party managers to implement these solutions.\n\n3. **Wealth Advisory Services**: They provide specialized wealth advisory services primarily to ultra-high-net-worth clients, offering personalized financial planning, investment advisory solutions, and private banking services, including loans and deposit alternatives.\n\n4. **Global Reach**: The firm operates globally, serving a diverse clientele that includes individuals, families, family offices, foundations, and endowments. They establish relationships directly or through corporate referrals and financial wellness programs.\n\n5. **Integration of Sustainability**: Goldman Sachs incorporates sustainability into its Asset and Wealth Management strategy by offering sustainability-related capabilities across public and private markets. This includes working with clients on their sustainability objectives and integrating climate-related risks into their risk management framework.\n\nOverall, Goldman Sachs aims to provide a holistic approach to asset and wealth management that combines investment expertise, personalized service, and a commitment to sustainability.",
    "reference":"Goldman Sachs Asset and Wealth Management strategy focuses on managing client assets across equity, fixed income, and alternative investments, offering customized portfolio solutions to ultra-high-net-worth individuals, families, foundations, and endowments globally, combining proprietary and third-party investment offerings with personalized wealth advisory services.",
    "faithfulness":1.0,
    "answer_relevancy":0.998111608,
    "context_precision":0.8333333333,
    "context_recall":1.0
  }
]